,frequency,presence
having the same problem,1,1.0
stupid and i really,1,1.0
was singing she s,1,1.0
standing up all day,1,1.0
one beat up little,1,1.0
hey thanks for following,1,3.0
you so suck when,1,1.0
always leave me behind,1,1.0
do nt care so,1,1.0
part of the job,1,1.0
to work again i,1,1.0
i had a little,1,1.0
stay away from home,1,1.0
trading below at only,1,1.0
s been nothing but,1,1.0
nt find a karaoke,1,1.0
be going to bed,1,1.0
but your not following,1,1.0
sad bout havin to,1,1.0
msn wont sign in,1,1.0
is drowsy from too,1,1.0
pritchard should have got,1,6.0
for sale on craigslist,1,1.0
me cry i miss,1,1.0
of an uber also,1,8.0
this loss will help,1,1.0
i just missed home,1,3.0
music teacher either expired,1,1.0
i dk what to,1,1.0
only one i love,1,1.0
not surprising every time,1,1.0
families he never quit,1,1.0
get service endless loop,1,1.0
even come meet me,1,1.0
to this zindex problem,1,1.0
nt had a good,1,1.0
i always forget you,1,1.0
i m just sick,1,1.0
nt let me play,1,1.0
the secret namerebecca please,1,1.0
few slices of cheddar,1,1.0
hate packing even more,1,1.0
school amp picking me,1,1.0
forget you are on,1,1.0
do something to fix,1,1.0
my being wants to,1,1.0
me off and not,1,1.0
the weekend that is,1,1.0
and they hurt what,1,1.0
i feel all anxious,1,1.0
scrubbing them and feet,1,7.0
es do nt make,1,3.0
nt wait til summer,1,1.0
he then socked me,1,1.0
seem to make me,1,1.0
wicked fun even tho,1,1.0
week all week off,1,1.0
having no service sucks,1,1.0
for a show in,1,1.0
wo nt be getting,1,1.0
the only sober one,1,1.0
to see you all,1,1.0
my sims file that,1,1.0
ahh i hate being,1,1.0
u would nt listen,1,1.0
reflux and that it,1,1.0
just up birthday for,1,1.0
my phone is nt,1,2.0
i think i care,1,1.0
broken to get the,1,1.0
m giving up on,1,1.0
off a guy who,1,1.0
with the average person,1,1.0
thats the crazy part,1,1.0
do nt reply to,1,1.0
do nt i know,1,1.0
to see any of,1,1.0
t does nt make,1,1.0
think my twitpic is,1,1.0
not stress how much,1,1.0
this day will pass,1,1.0
you right in the,1,1.0
cant sleep i dont,1,2.0
feeling poorly are you,1,2.0
fake id or something,1,1.0
mine omg that s,1,1.0
lunch sucked ran out,1,1.0
so sorry i hate,1,1.0
sick not feeling so,1,1.0
pc i know im,1,1.0
at sapinsidetrack in palo,1,3.0
sucks so much because,1,1.0
smh i think im,1,1.0
forgive me i m,1,1.0
so miss the gym,1,1.0
not spend the weekend,1,1.0
snl does not dissapoint,1,1.0
weekend fever anymore when,1,1.0
will be poor tho,1,1.0
come visit us when,1,1.0
walking up and down,1,1.0
before getting your neck,1,1.0
cheek is totally numb,1,1.0
entry just lost an,1,1.0
i miss it there,1,1.0
hurting from the barca,1,1.0
brought the bad weather,1,1.0
work days off isnt,1,1.0
i have bad news,1,1.0
turn you head to,1,1.0
i m getting old,1,1.0
so addicting but its,1,2.0
spent too much already,1,1.0
s ugh something like,1,1.0
amp i got ta,1,1.0
all our twittering is,1,8.0
it feels like ages,1,1.0
my teratoma has a,1,1.0
in bed sick heavy,1,1.0
dont ever send me,1,1.0
hey sorry i did,1,1.0
the polish off of,1,1.0
the house does nt,1,1.0
no party this weekend,1,1.0
with the wee stpid,1,1.0
soo much work to,1,1.0
sorry about your headahce,1,1.0
amp i miss alas,1,1.0
sitting on my on,1,1.0
ca nt keep up,1,1.0
bored in chem n,1,1.0
ve seriously had enough,1,1.0
been working lots of,1,1.0
hate screaming children besides,1,1.0
bored of walking up,1,1.0
be there this summer,1,1.0
to in my p.e,1,1.0
eating breakfast getting ready,1,1.0
sure that it s,1,1.0
here in texas and,1,1.0
must think i am,1,1.0
was just a dream,1,1.0
talent is giving me,1,1.0
tree thru our bathroom,1,1.0
of backup planes and,1,1.0
if u even care,1,1.0
harrump gagging for beer,1,1.0
a job that can,1,1.0
that i missed the,1,1.0
i m there huh,1,1.0
which takes the piss,1,1.0
it d be stupid,1,1.0
i cant sleep buzz,1,1.0
there s a spider,1,1.0
failed a class and,1,1.0
to us what if,1,1.0
that i spent hours,1,1.0
tomorrow because it takes,1,1.0
modem failedhaving pc withdrawals,1,1.0
parents the bed was,1,1.0
ca nt see because,1,1.0
i wish our did,1,1.0
i was talking to,1,1.0
m a lil sad,1,1.0
even hold them and,1,1.0
like death evil headache,1,1.0
week get anymore horrible,1,1.0
too bad my cable,1,1.0
is feeling so bored,1,1.0
me work during the,1,1.0
m really getting sick,1,1.0
the door handle murdered,1,1.0
was i not cool,1,1.0
m not feeling very,1,1.0
my highest weight ever,1,1.0
be able to talk,1,1.0
much money hate that,1,1.0
am going to get,1,1.0
gone i am sad,1,1.0
i just cant concentrate,1,1.0
mouth my right cheek,1,1.0
surgery yesterday so mommy,1,1.0
feel right without em,1,1.0
fabulously queer i miss,1,1.0
not a heap hey,1,1.0
for a few days,1,1.0
will not last long,1,1.0
off to work then,1,1.0
sorry to hear you,1,1.0
how i wish my,1,1.0
is almost over the,1,1.0
i know man my,1,1.0
i m sickk tomorrow,1,1.0
my head hurts because,1,1.0
does that why has,1,1.0
this is soo crazy,1,1.0
waking up and still,1,1.0
mine for an entire,1,1.0
is not good no,1,1.0
way too much extra,1,1.0
do but they say,1,1.0
do nt feel like,1,1.0
started taking its toll,1,1.0
bangs i want my,1,1.0
omg guys my internet,1,1.0
toes not friendly or,1,1.0
not happen in any,1,1.0
imagine now it will,1,1.0
it is very sad,1,1.0
brittany forgot my flowers,1,1.0
nt leave forever we,1,1.0
look at my bio,1,1.0
go to granulation tonight,1,1.0
had nothing to do,1,1.0
nt like us happy,1,2.0
sad assembly next block,1,1.0
shoulder is burnt from,1,1.0
got problems with battery,1,1.0
hopeful with the things,1,1.0
those houses were a,1,1.0
the year tax wise,1,1.0
dark side of me,1,1.0
with a old biker,1,1.0
sorry quot roll okay,1,1.0
demad isnt working right,1,1.0
all the in jokes,1,1.0
soo bad i hate,1,1.0
still no direct message,1,1.0
why cant i find,1,1.0
a craving that s,1,1.0
any of the sun,1,1.0
not a happy tw,1,1.0
i hate my arrival,1,1.0
on a broken coffee,1,1.0
wanted to be sick,1,1.0
have no ride boo,1,1.0
an hour late because,1,1.0
yay my train is,1,1.0
that s no good,1,1.0
internal clock really is,1,1.0
gt and i fee,1,1.0
literally falling apart so,1,1.0
tribute and more of,1,1.0
dizzy going to have,1,1.0
management gpu one sad,1,1.0
their account was deleted,1,1.0
tell them that they,1,1.0
eirtaku got hit by,1,1.0
monday great rainy monday,1,1.0
your fault i didnt,1,1.0
i am not doing,1,1.0
someone sing to me,1,1.0
cuz no one will,1,1.0
not really able to,1,1.0
the day feeling sorry,1,1.0
stupid kids on my,1,1.0
or email at my,1,1.0
say you should nt,1,1.0
she s probably worried,1,1.0
not working ugh also,1,1.0
nt stop honking at,1,1.0
no one to tie,1,1.0
bored but i refuse,1,1.0
my bio and by,1,1.0
amp so does my,1,1.0
be no gym class,1,1.0
wont let her now,1,1.0
rather be a class,1,1.0
nt talked to you,1,1.0
disturbance at sapinsidetrack in,1,1.0
really brummie lol but,1,1.0
of the people i,1,1.0
what kind of mess,1,1.0
chat has died so,1,1.0
late arriving from london,1,1.0
gosh no need to,1,1.0
middle of an uber,1,1.0
well all the sudden,1,1.0
to go to my,1,1.0
the hell is it,1,1.0
my cyberstalking skills the,1,1.0
about the fact that,1,1.0
bus stuck in traffic,1,1.0
at writing tonight seem,1,2.0
they got crappy seats,1,1.0
missing my favorite sisters,1,1.0
does nt sound happy,1,1.0
the bath do nt,1,1.0
heart goes out to,1,1.0
i dont acid reflux,1,1.0
ohio is for lovers,1,1.0
spider in my room,1,1.0
and one foot foul,1,1.0
sick i want to,1,1.0
below at only per,1,1.0
i miss my girlies,1,1.0
was boring but had,1,1.0
some guy just said,1,1.0
were hopelessly out of,1,1.0
sleep buzz me bebe,1,1.0
for being complete fucktards,1,1.0
for my ipod touch,1,1.0
heat will be too,1,1.0
hate missing gumbo but,1,1.0
no bed no problem,1,1.0
son he s just,1,1.0
not lucky never have,1,1.0
does nt make up,1,1.0
the aila cyclone left,1,1.0
i dont believe in,1,1.0
got exam week this,1,1.0
me amp my big,1,1.0
are nt normal then,1,1.0
we didnt see you,1,1.0
sorry today s been,1,1.0
an excellent excuse earlier,1,1.0
today it hurts to,1,1.0
to the forever curse,1,1.0
id much rather be,1,1.0
some pervert just ruined,1,1.0
m already on the,1,1.0
a row and get,1,1.0
coffee now it s,1,1.0
i could find one,1,1.0
and i m really,1,1.0
hmm i rly am,1,1.0
had a nosebleed first,1,1.0
stop biting my nails,1,1.0
wishing i was nt,1,1.0
na get dressed up,1,1.0
has been too much,1,1.0
free minute button did,1,1.0
too and it shocked,1,1.0
headed to the hospital,1,1.0
that is really sad,1,1.0
wtf she just bit,1,1.0
missed a lot while,1,1.0
any remedies for neck,1,1.0
callers who were trying,1,1.0
m scared of him,1,1.0
too much for me,1,1.0
mad i like speaking,1,1.0
our walks home together,1,1.0
am pretty sure i,1,1.0
until i finish the,1,1.0
met the hubby that,1,1.0
i have to say,1,1.0
much pain i really,1,1.0
did well and only,1,1.0
sound a bit down,1,1.0
and now i m,1,1.0
tierd in my life.u,1,1.0
pretty much on the,1,1.0
piss flap a times,1,1.0
in his back and,1,1.0
twitter s being mean,1,1.0
the gm bankruptcy is,1,1.0
juss cantt sleepp omq,1,1.0
ep album argghh prayers,1,1.0
with myself this morn,1,1.0
am not happy at,1,1.0
i have been very,1,1.0
how come you cant,1,1.0
on the edge of,1,1.0
this selfdenial is harmful,1,1.0
no one s going,1,1.0
shift at work what,1,1.0
morrissey il just go,1,1.0
we get to be,1,1.0
so suck when are,1,1.0
i ca nt write,1,1.0
is nt a dud,1,1.0
thing s a bugger,1,1.0
u but its soo,1,1.0
to miss because i,1,1.0
when i was younger,1,1.0
were i stand and,1,1.0
my bottom lip on,1,1.0
me in a bad,1,1.0
in the bread who,1,1.0
different guild wtf is,1,1.0
in traffic gon na,1,1.0
good at all fuckk,1,1.0
now why is it,1,1.0
selling my drumset sad,1,2.0
my boss have to,1,1.0
now and i have,1,1.0
up too and im,1,12.0
but most of all,1,1.0
have to vomit assholes,1,1.0
to cats my tonsils,1,1.0
i m quarantined everywhere,1,1.0
and this really sucks,1,1.0
i see pregnant women,1,1.0
a low budget video,1,1.0
to the say now,1,1.0
heffas decided to take,1,1.0
sorry that was a,1,1.0
we ll miss u,1,1.0
being forced to use,1,1.0
closed the side door,1,1.0
why do you not,1,1.0
a pain house shifting,1,2.0
i feel really sick,1,1.0
first day of work,1,1.0
she saw it and,1,1.0
i m doing my,1,1.0
seems to tan apart,1,1.0
got a deadline to,1,1.0
going on with my,1,1.0
moment of the day,1,1.0
really has everything covered,1,1.0
big blue selected tweet,1,1.0
i hope i get,1,1.0
in ss this means,1,1.0
only problem will be,1,1.0
bad cards i suck,1,9.0
m hot now running,1,7.0
and then i find,1,1.0
he s pissing me,1,1.0
i hate that i,1,1.0
ill from work this,1,1.0
aww i feel so,1,1.0
seasons that s it,1,1.0
everyone have plans it,1,1.0
me what the hell,1,1.0
flew into my window,1,1.0
rest sad bout havin,1,1.0
m not a fan,1,1.0
thaught i tweet it,1,1.0
did nt like me,1,1.0
that s just weird,1,1.0
v v bad sunburn,1,1.0
arrival new espresso machine,1,1.0
i supose yas dnt,1,1.0
it not lunch time,1,1.0
a little too much,1,1.0
had something to do,1,1.0
for weeks it s,1,1.0
s snl does not,1,1.0
gig this weekend i,1,1.0
m insulting you i,1,3.0
the sun today its,1,1.0
wow i feel like,1,1.0
feels like its getting,1,1.0
liesboystell your the only,1,1.0
it s the heat,1,1.0
go back to normal,1,1.0
all anxious and yucky,1,1.0
kind of miss my,1,1.0
got laid off lots,1,1.0
that just does nt,1,1.0
been foking up for,1,2.0
not on purpose something,1,1.0
she sees that she,1,1.0
cuz i know i,1,1.0
drunk girl for steppin,1,1.0
the whole twitter silence,1,1.0
nt come out the,1,1.0
a dentist before i,1,1.0
have any pets in,1,1.0
of lung cancer at,1,1.0
late and could nt,1,1.0
awful traffic in the,1,1.0
the middle layers of,1,1.0
sorry me amp my,1,1.0
man i m sick,1,2.0
believe a man died,1,1.0
possible to a have,1,1.0
it is i never,1,9.0
not what i meant,1,4.0
than you lol i,1,3.0
na miss this place,1,2.0
super pain packing never,1,1.0
i still have washing,1,1.0
on the first day,1,1.0
disapointed in ciber and,1,1.0
in the rear view,1,1.0
of the totem pole,1,1.0
it was just a,1,1.0
what if they are,1,1.0
its not at all,1,1.0
everything about seafood just,1,1.0
lower part of my,1,1.0
monday bak to college,1,1.0
muscle issue in his,1,1.0
but is paying the,1,1.0
with geeta feeling like,1,1.0
doesnt look like the,1,1.0
understand how devastated she,1,1.0
not refused to feel,1,2.0
wide awake wishing i,1,1.0
not a nice feeling,1,1.0
i ca nt afford,1,1.0
stuck in the plane,1,1.0
mom is sick so,1,1.0
throat coming and recording,1,1.0
should nt sit weirdly,1,1.0
bies i have to,1,1.0
the cell nothin like,1,1.0
to someone burnt food,1,2.0
out of touch with,1,1.0
get here fast enough,1,1.0
android phone when i,1,1.0
house smelled like a,1,1.0
been declined at this,1,1.0
my internet right in,1,1.0
i m really mad,1,2.0
they think i m,1,1.0
they always seem to,1,1.0
i have so many,1,1.0
nd was in the,1,1.0
we re gon na,1,8.0
it gets better i,1,1.0
that was stone cold,1,4.0
little too much sun,1,12.0
worst of the year,1,1.0
deleted due to quot,1,1.0
fly to ohio i,1,1.0
sometimes i miss teaching,1,1.0
the house in the,1,1.0
and killing our productivity,1,1.0
gets too chilly at,1,1.0
big sam houston is,1,1.0
odd i tried to,1,1.0
no sry did nt,1,1.0
much going on in,1,1.0
seem to find it,1,1.0
leaving me outside waiting,1,1.0
the joys of multiple,1,1.0
exhausted after a hour,1,1.0
fraudster on the loose,1,1.0
pissing me off ugh,1,1.0
out of bed with,1,1.0
be wednesday already so,1,1.0
to cough up a,1,1.0
very very rough today,1,1.0
i wan na start,1,1.0
a sudden turn for,1,1.0
i still have to,1,1.0
him not to poke,1,1.0
m watching aladdin now,1,1.0
i miss nicc today,1,1.0
qdoba does nt feel,1,1.0
no invert call tree,1,1.0
time for us girls,1,1.0
marked as a phishing,1,1.0
no good i pierced,1,1.0
still makin me work,1,1.0
that just means you,1,1.0
annoyed cos this weekend,1,1.0
are not the only,1,1.0
this one is a,1,1.0
keeps cutting out for,1,1.0
night all of my,1,1.0
wow yo my boy,1,1.0
s stopped tweeting my,1,1.0
face moment of the,1,1.0
his tea and oatmeal,1,1.0
oh geez i ll,1,1.0
have not been productive,1,1.0
a serial card fraudster,1,1.0
run out of texts,1,1.0
found out one of,1,1.0
has been super weird,1,1.0
t i am stuck,1,1.0
the people i talk,1,1.0
im going to be,1,1.0
who cares its hockey,1,1.0
miss him so much,1,1.0
have sore throat that,1,1.0
stuff onto the ice,1,1.0
saw it and she,1,1.0
aww i miss driving,1,1.0
but it was so,1,1.0
got in a fist,1,1.0
gon na bother people,1,1.0
ugh i m not,1,1.0
nt get any work,1,1.0
got my phone fixed,1,1.0
to badu tonight you,1,1.0
pain i really do,1,1.0
lookin forward to monday,1,1.0
and i m working,1,1.0
me too no one,1,1.0
doing my junior cert,1,1.0
the nearest bridge if,1,1.0
tape with fungus badluck,1,1.0
a long time too,1,1.0
nt like this game,1,1.0
not it just sucks,1,1.0
hate it when i,1,1.0
sam houston is not,1,1.0
abt firefox crashing on,1,1.0
nt think my friends,1,1.0
they should shut the,1,1.0
nt fair gt and,1,1.0
cant even be outside,1,1.0
i know you were,1,1.0
have to throw up,1,1.0
world is full if,1,1.0
bye before i leave,1,1.0
to be helping and,1,1.0
been trying to cheer,1,1.0
your dance friends too,1,1.0
i missed the party,1,9.0
dont cry i feel,1,1.0
i swear now my,1,1.0
right side myself in,1,1.0
why ca nt people,1,1.0
bored i have nothing,1,1.0
there s still dirt,1,1.0
fat i know i,1,1.0
unless you are caught,1,1.0
is very unlucky the,1,1.0
but instead here lies,1,1.0
watching them die is,1,1.0
find the original on,1,1.0
being under drugs i,1,1.0
see her in a,1,1.0
my cousin so much,1,1.0
is my bestie when,1,1.0
right in the only,1,1.0
nt seem to access,1,1.0
not feeling so great,1,1.0
cant find my hoodie,1,1.0
o stop making fun,1,1.0
i will soon be,1,1.0
nt find anything tempting,1,1.0
of my friends at,1,1.0
crying of someone i,1,1.0
amp physically it made,1,1.0
a bad time remember,1,1.0
you do nt do,1,1.0
burned like a ginger,1,1.0
ya it was pretty,1,1.0
to ask me about,1,1.0
to dr s part,1,1.0
ginger kid in the,1,1.0
m such a rebel,1,2.0
a good day one,1,1.0
bummed that f f,1,1.0
s dead and gon,1,1.0
toe at the bar,1,1.0
usual semiflaky self but,1,1.0
b i missed it,1,1.0
is an excellent excuse,1,1.0
not do it i,1,1.0
times and they wont,1,1.0
of novacaine in my,1,1.0
was nt at the,1,1.0
think the coffee at,1,1.0
may officially announced as,1,1.0
what gear is it,1,1.0
missed all the in,1,1.0
jealousy this selfdenial is,1,1.0
none of you are,1,1.0
get in my way,1,1.0
she passed last week,1,1.0
arg eirtaku got hit,1,1.0
not even half as,1,1.0
does nt work either,1,1.0
i did not see,1,1.0
am afraid no doubt,1,1.0
tweets were mia twitter,1,1.0
feel really panicky and,1,1.0
i hate moving and,1,1.0
ever send me notices,1,1.0
know i m really,1,1.0
my phone just died,1,1.0
wish i could meet,1,2.0
off the nearest bridge,1,1.0
i hate that son,1,1.0
in a hospital for,1,1.0
til i dropped come,1,1.0
going to suck wi,1,17.0
core duo just ca,1,1.0
re bees that will,1,1.0
and i m totally,1,1.0
gross i m so,1,1.0
perfect on tonight s,1,1.0
soo jealous right now,1,1.0
nt talk and delirious,1,1.0
i had pretty high,1,1.0
m afraid not much,1,1.0
i give in to,1,1.0
s not the most,1,1.0
tea was rubbish and,1,1.0
bed no problem no,1,1.0
you are forced to,1,1.0
miss having an it,1,1.0
smelled like a bowling,1,1.0
find one that was,1,1.0
keep her in your,1,1.0
cleaning her room and,1,2.0
cheesy disco music has,1,1.0
lights killed the mood,1,1.0
and im missing their,1,1.0
re still no shows,1,1.0
miss the newest version,1,1.0
blackberry but ca nt,1,1.0
me know if i,1,1.0
charge way too much,1,1.0
i need to be,1,1.0
that it will turn,1,1.0
s looking rly dead,1,1.0
miss your dance friends,1,1.0
not the most pleasant,1,1.0
i like speaking my,1,1.0
i cant go see,1,1.0
got any remedies for,1,1.0
who died in a,1,1.0
vote if i could,1,1.0
what i meant just,1,1.0
tweet at work i,1,1.0
stuck in doors all,1,1.0
ll i miss tunnocks,1,1.0
mic does nt work,1,9.0
the mediation program suckss,1,4.0
day will pass slowly,1,3.0
alone cuz no one,1,1.0
in it any idea,1,1.0
like this part of,1,1.0
just have made me,1,1.0
news has come up,1,1.0
the girlys soo super,1,1.0
not friends with anyone,1,1.0
disney movie too bad,1,1.0
sick had such a,1,1.0
my right kidney hurts,1,1.0
am but she did,1,1.0
my heart i m,1,1.0
gd news for gods,1,1.0
and down the stairs,1,1.0
law abiding citizens wo,1,1.0
myself a stroke everytime,1,1.0
i know im going,1,2.0
she is indeed nuts,1,1.0
today but i cant,1,1.0
monday not so great,1,1.0
having one of my,1,1.0
if i ll survive,1,1.0
son wtf she just,1,1.0
gon na be a,1,1.0
it off i feel,1,1.0
a bust house smelled,1,1.0
abandoned on the sidewalk,1,1.0
quot most uttered words,1,1.0
computer is being killed,1,1.0
they re for my,1,1.0
baby has his first,1,1.0
to do it in,1,1.0
miss this place but,1,1.0
long suspected twitter is,1,1.0
exit in this hallway,1,1.0
nt know what lender,1,1.0
starving and ca nt,1,1.0
i kinda lost respect,1,1.0
puts me to shame,1,1.0
for my last weekend,1,1.0
have to cover extra,1,1.0
u have no around,1,1.0
physics and now i,1,1.0
pain for my friend,1,1.0
is not fare on,1,1.0
crazy kids wo nt,1,1.0
to happen one day,1,1.0
mention i feel like,1,1.0
i think i am,1,1.0
guys are soo unfair,1,1.0
came home you so,1,1.0
my feet are cold,1,1.0
cold i hate when,1,1.0
did nt feel well,1,1.0
feel very well right,1,1.0
need my hugs anymore,1,2.0
was nt feeling it,1,2.0
way to school of,1,1.0
victim like your people,1,1.0
really gon na miss,1,1.0
but i ai nt,1,1.0
at work what fun,1,1.0
is saddened by husker,1,9.0
so does my stomach,1,14.0
twitter i do nt,1,5.0
goodbye to the younger,1,2.0
i m not unique,1,1.0
dont think my twitpic,1,1.0
you wo nt find,1,1.0
up my mobile ack,1,3.0
there soon for support,1,2.0
working hard or maybe,1,1.0
i m alright thanks,1,1.0
excited when i thought,1,1.0
to do some geekshopping,1,1.0
no longer recognize my,1,1.0
to be cleaning her,1,1.0
no internet for the,1,1.0
what should i do,1,1.0
stupid headache would go,1,1.0
relaxing like i hoped,1,1.0
i really need a,1,1.0
that i m insulting,1,1.0
hope i do nt,1,1.0
idiot who ran a,1,1.0
entire day just to,1,1.0
today is gon na,1,1.0
not a fun day,1,1.0
greg noo don leave,1,1.0
they hurt what do,1,1.0
is worse than taxes,1,1.0
version on glade on,1,1.0
to be relaxing like,1,1.0
stress though so with,1,1.0
is that it s,1,1.0
being ignored not a,1,1.0
looked awful this morning,1,1.0
road it happened at,1,1.0
living down here in,1,1.0
death of me i,1,2.0
much happened today i,1,1.0
lunch with my wife,1,1.0
never made it to,1,1.0
i ve been trying,1,1.0
only is twitter its,1,1.0
i want onscreen keyboard,1,1.0
why did sound input,1,1.0
all of my blog,1,1.0
that kind of difficult,1,1.0
bored nothing to do,1,1.0
who call him then,1,1.0
slap you in public,1,1.0
but its kind of,1,1.0
baking bowl milk spilled,1,1.0
not been productive at,1,16.0
m not cool enough,1,11.0
just realized that i,1,3.0
gumbo but i have,1,1.0
then i go very,1,1.0
work again i never,1,1.0
took off a guy,1,3.0
i miss that thing,1,1.0
horrid i need a,1,1.0
can get soo dull,1,1.0
really do nt feel,1,12.0
these people definitely sucked,1,1.0
right now why is,1,1.0
all week and still,1,1.0
still feeling poorly are,1,1.0
right and my internet,1,1.0
home again they hate,1,1.0
possessed and wo nt,1,1.0
n im super hungry,1,1.0
gon na miss mh,1,1.0
hey you that s,1,1.0
not ready for it,1,1.0
plus i have drama,1,1.0
burton and end up,1,1.0
wow so i hate,1,1.0
much i miss him,1,1.0
pm rolled around really,1,1.0
is it today quot,1,1.0
am having a godawful,1,1.0
do nt think my,1,1.0
she s not impressed,1,1.0
slammed her head into,1,1.0
i m insulting you,1,1.0
fake being paris anymore,1,1.0
poor butterfly was dead,1,1.0
fair gt and i,1,1.0
mx which automatically makes,1,1.0
have the weirdest hives,1,1.0
who i will never,1,1.0
worst feeling waking up,1,1.0
we get no appreciation,1,2.0
ugh also mom wont,1,1.0
creek the nasty things,1,1.0
keep it together but,1,1.0
really sad because she,1,1.0
yourself too so did,1,1.0
probably be peed off,1,1.0
bit mr rat took,1,1.0
am so sorry sorry,1,1.0
i have a hole,1,1.0
na go to track,1,1.0
work agreed with my,1,1.0
hate bad grades time,1,1.0
early at today now,1,1.0
put me into a,1,1.0
show how much i,1,1.0
kid s packing but,1,1.0
watching the telly and,1,1.0
r.i.p fristy just thinking,1,1.0
of my blog posts,1,1.0
eating disorders are not,1,1.0
nt want to get,1,1.0
cried like a baby,1,1.0
what i just missed,1,1.0
was a lot of,1,1.0
sweat is just not,1,1.0
hour late because of,1,1.0
my boy is really,1,1.0
that had to be,1,1.0
was thinking just before,1,1.0
tonight s snl does,1,1.0
a sitter wtf why,1,1.0
lost my keys at,1,1.0
miss our walks home,1,1.0
sunburn on my knees,1,1.0
i have never had,1,1.0
miss ya ll lol.don,1,1.0
the nasty things can,1,1.0
you were not trying,1,1.0
got erased sry guys,1,1.0
of all i just,1,1.0
movie out today but,1,1.0
they burnt my zuccini,1,1.0
of my mind lol,1,1.0
maybe i am the,1,1.0
the ice i thought,1,1.0
creativity worse if you,1,1.0
i do nt do,1,1.0
now my hand hurts,1,1.0
well ard he puts,1,1.0
miss seeing you like,1,1.0
twitter stop being a,1,1.0
but we had a,1,1.0
my back feels like,1,1.0
cream do not want,1,1.0
want to be left,1,1.0
i have to throw,1,1.0
i m fat i,1,1.0
the fact that it,1,1.0
we were soaking our,1,1.0
i have way too,1,1.0
to be sick no,1,1.0
what do u see,1,1.0
cuz i do nt,1,1.0
it ll have to,1,1.0
and it completely reminds,1,1.0
e is nt legal,1,1.0
my heart just broke,1,1.0
woke up feeling worse,1,1.0
i m very upset,1,1.0
i never want to,1,1.0
now my bum hurts,1,1.0
faces haha basically headache,1,1.0
had a good week,1,1.0
a pain if you,1,1.0
it s even hot,1,1.0
i was singing she,1,1.0
quot is the only,1,1.0
labeled electric but is,1,1.0
and can quot they,1,1.0
really been a turnon,1,1.0
are the irate callers,1,1.0
the place called of,1,1.0
know what lender it,1,1.0
busy and now it,1,1.0
too much sun today,1,1.0
beer buzz is almost,1,1.0
they make me wise,1,1.0
just got home and,1,1.0
so stressed and sad,1,1.0
account was deleted due,1,1.0
i m feeling pissy,1,1.0
ve got no money,1,1.0
bummed i wo nt,1,1.0
for making me go,1,2.0
i m sat on,1,1.0
the qfc parking lot,1,1.0
i just found a,1,1.0
does nt cover it,1,1.0
it happened at and,1,1.0
m sickk tomorrow will,1,1.0
no i was thinking,1,1.0
worst of all no,1,1.0
you do when u,1,1.0
didnt make u leave,1,1.0
ugh still sick this,1,1.0
that past few days,1,4.0
power was cut off,1,1.0
i really feel bad,1,1.0
or very late its,1,2.0
loadsa shizze has happend,1,9.0
not having any luck,1,14.0
how devastated she is,1,5.0
last saturday in ec,1,1.0
fu k a hose,1,1.0
him he s so,1,1.0
irate callers who were,1,1.0
your not following me,1,1.0
as i will be,1,1.0
but i juss cantt,1,1.0
m not sleeping at,1,1.0
i miss my tdub,1,1.0
but the sun has,1,1.0
quot i m giving,1,1.0
us when you have,1,1.0
still does nt love,1,1.0
feet are killing me,1,1.0
my macbook pro getting,1,1.0
flies when u got,1,1.0
work hagg lake tomorrow,1,1.0
working on a saturday,1,1.0
b over and done,1,2.0
treats on my food,1,1.0
to be at work,1,1.0
fan page will get,1,1.0
a nogo since i,1,1.0
is a bit of,1,1.0
a blog now they,1,1.0
is wrong with my,1,1.0
to do my hair,1,1.0
me out but i,1,1.0
nt sample it when,1,1.0
remembered of pentecost uselessly,1,1.0
look good we have,1,1.0
head to parallel park,1,1.0
my saturday is going,1,1.0
everyone seems to make,1,1.0
well at all today,1,1.0
i had money to,1,1.0
soo tired still kinda,1,1.0
i m watching aladdin,1,1.0
forgot to ask me,1,1.0
the finger the door,1,1.0
hopefully you re not,1,1.0
bus goin home what,1,1.0
and at he was,1,1.0
and less replies are,1,1.0
even tease people now,1,1.0
it starts here but,1,1.0
afraid not much i,1,1.0
got our orphan lambs,1,1.0
thats actually not that,1,1.0
i know the feeling,1,1.0
then it has to,1,1.0
traffic gon na be,1,1.0
i m trapped at,1,9.0
like i m going,1,4.0
is broken no red,1,1.0
bac sunshine i miss,1,1.0
flat route available the,1,1.0
you did nt day,1,1.0
