,frequency,presence
s not lettin me,1,1.0
u guys said california,1,1.0
a creepy stalker or,1,1.0
to the west coast,1,1.0
m alone and sleepy,1,1.0
seriously missing my macbook,1,1.0
have gained a lil,1,1.0
of all no one,1,1.0
wish someone was laying,1,1.0
at and i had,1,1.0
that and then there,1,1.0
one day but i,1,1.0
i was being serious,1,1.0
by carrie underwood makes,1,1.0
week doesnt look like,1,1.0
nt think the coffee,1,2.0
today is going to,1,1.0
run out in my,1,1.0
oh no please dont,1,1.0
with no capacity to,1,1.0
my messages are nt,1,1.0
hurts soo bad right,1,1.0
writing a rant about,1,4.0
anymore nothing hurts quite,1,4.0
the chow hall nooww,1,1.0
sending angry vibes to,1,1.0
this website gave me,1,1.0
failed on first day,1,1.0
not the only reason,1,1.0
but getting a burrito,1,1.0
to go into work,1,1.0
hates typing on a,1,1.0
nt seem to come,1,1.0
amp trying to get,1,1.0
nt get tickets for,1,3.0
i see i gets,1,1.0
not big enough to,1,1.0
find my charger my,1,1.0
wreck today just right,1,1.0
they had no license,1,1.0
amp picking me up,1,1.0
had slept in more,1,1.0
your car i feel,1,1.0
filthy bloody mess lovely,1,1.0
what a busy day,1,1.0
there s nothing good,1,1.0
do nt blame me,1,1.0
at least you wont,1,1.0
not watch the movie,1,1.0
so horrid i need,1,1.0
its taking forever to,1,1.0
some gd news for,1,1.0
missed you last night,1,1.0
nt sound so great,1,1.0
day in the middle,1,1.0
aww i wish i,1,1.0
what s worse is,1,1.0
are now laid off,1,5.0
today feels like friday,1,5.0
i have no ride,1,1.0
no free ice cream,1,1.0
you re a bad,1,1.0
fail at life sometimes,1,1.0
nt held onto the,1,1.0
here rly rly wet,1,1.0
that lying in bed,1,1.0
one with reasonable rent,1,1.0
and peanut butter stupid,1,1.0
direct message for me,1,1.0
noone wants to play,1,1.0
so much work so,1,1.0
him so much they,1,1.0
rained out at the,1,1.0
i miss my husband,1,1.0
i m engulfed in,1,1.0
do nt really wan,1,1.0
jered to the death,1,1.0
i hate knowing my,1,1.0
to focus on kid,1,1.0
he bruised his forehead,1,1.0
bird that flew into,1,1.0
i missed all ur,1,1.0
did nt respond what,1,1.0
in that ur seeing,1,1.0
christian is to put,1,4.0
belt thing is a,1,1.0
u even care about,1,1.0
surprising every time they,1,1.0
its just so sad,1,1.0
my inerne is or,1,1.0
have no proof against,1,1.0
work got erased sry,1,1.0
last theater lunch im,1,1.0
not sure when your,1,1.0
there was nothing magical,1,1.0
nt figure out the,1,1.0
sometimes i think you,1,1.0
us girls that follow,1,1.0
here and say hi,1,1.0
engagement session in a,1,1.0
to break in my,1,1.0
and now it s,1,1.0
has got his hat,1,1.0
what the it s,1,1.0
will eventually happen in,1,1.0
afraid no doubt here,1,1.0
m not good at,1,1.0
out deal w hr,1,1.0
how i miss the,1,1.0
pc i miss having,1,1.0
apart from me freckles,1,1.0
html version all day,1,1.0
i hate using public,1,1.0
i wo nt have,1,1.0
wish i did not,1,1.0
pets cant talk back,1,2.0
to start sigh midterms,1,1.0
always forget you are,1,1.0
i ever do to,1,1.0
know ay son he,1,1.0
too hot for me,1,1.0
a man died in,1,1.0
i could spend the,1,1.0
if i ca nt,1,1.0
that s not what,1,1.0
the quot baseball guy,1,1.0
god as first in,1,1.0
imm tired of callin,1,1.0
just means you were,1,1.0
is hte question that,1,1.0
house of a thousand,1,1.0
getting into this weekend,1,1.0
too it s just,1,1.0
to bed at and,1,1.0
to die if somebody,1,1.0
but it s to,1,1.0
days i am freaking,1,1.0
a bug in coding,1,1.0
laid off lots of,1,1.0
animal kingdom closes so,1,1.0
too many boys are,1,1.0
re not in the,1,1.0
m in alone my,1,2.0
enough movies to quot,1,1.0
its so hot here,1,1.0
started i just cant,1,1.0
goes out to you,1,1.0
with that in that,1,1.0
i need my car,1,1.0
like getting to other,1,1.0
to miss the homesskooler,1,2.0
money is all gone,1,1.0
lol but most of,1,1.0
i m very well,1,1.0
these heffas decided to,1,1.0
just so blah and,1,1.0
so i do nt,1,1.0
muscle in my neck,1,2.0
needed a new roof,1,1.0
i do not know,1,1.0
since this part of,1,1.0
worry haha i wish,1,1.0
na mess this uup,1,1.0
beyonce on monday uhmygawdd,1,1.0
is really sad because,1,1.0
as you would think,1,1.0
lake park kid is,1,1.0
die if they played,1,1.0
criminal with my cold,1,1.0
shizze has happend im,1,1.0
bike is dangero waa,1,1.0
ut i aint that,1,2.0
my mom doesnt wan,1,1.0
i sound really brummie,1,6.0
cold freakin cold brr,1,1.0
earlier i was sweating,1,1.0
fuzz magnet today and,1,1.0
t you make it,1,1.0
is so gutted she,1,1.0
moved out its gna,1,1.0
from lack of sleep,1,1.0
nt be awesome at,1,1.0
not enough to rest,1,1.0
food in the house,1,1.0
really gna miss it,1,16.0
hugh is nt on,1,2.0
girls r home for,1,1.0
a week and a,1,1.0
richie but i do,1,1.0
does nt quite fit,1,1.0
eaten and feel extremely,1,9.0
if i sleep for,1,4.0
u do nt play,1,3.0
giggle did come out,1,2.0
nt eat my dinner,1,1.0
about to start for,1,1.0
i am trying to,1,1.0
cheaper amp biz class,1,1.0
reading the news stories,1,1.0
really sad about this,1,1.0
hurt my foot amp,1,1.0
so sad really really,1,1.0
to be though wish,1,1.0
wo nt need my,1,1.0
is a fuzz magnet,1,1.0
wife like i wanted,1,1.0
sorry do you want,1,1.0
uber also first tweet,1,1.0
it s quite problematic,1,1.0
that it s considerably,1,1.0
trees around their house,1,1.0
the wrong way bah,1,1.0
we are quot arguing,1,1.0
neti pot is working,1,1.0
and my boss is,1,1.0
she is waiting very,1,1.0
design i may cry,1,1.0
wife s tummy hurts,1,1.0
takes all effing day,1,1.0
why did no one,1,1.0
i can not wish,1,1.0
was having trouble account,1,1.0
m falling apart in,1,1.0
me wide awake i,1,1.0
i to kick monday,1,1.0
in balling she just,1,1.0
not in the fun,1,1.0
to give up my,1,1.0
its so addicting but,1,1.0
that the girls r,1,1.0
i m all alone,1,1.0
u guys are soo,1,1.0
i ca nt move,1,1.0
pinkeye go away already,1,1.0
my luck is done,1,1.0
drank it on the,1,1.0
put god as first,1,1.0
laying next to me,1,1.0
they do nt let,1,1.0
s almost all enlargement,1,1.0
i hate that place,1,1.0
day sometimes ca nt,1,1.0
that he wants to,1,1.0
me dead on sofa,1,1.0
need to head downtown,1,1.0
has happend im so,1,1.0
i totally ca nt,1,1.0
grabbed it and it,1,1.0
and feel less apathetic,1,1.0
nt people just be,1,1.0
get dressed up an,1,1.0
dare you even ask,1,1.0
poorer than you lol,1,1.0
why doesnt he want,1,1.0
go out cause it,1,1.0
stole mine for an,1,1.0
morning just feels like,1,1.0
i used to hate,1,1.0
effect no one to,1,1.0
passed away in december,1,1.0
got ta deal with,1,1.0
m soo jealous right,1,1.0
ve ever been so,1,1.0
m having the worst,1,1.0
the bread who does,1,1.0
bugs attacking my laptop,1,1.0
to talk to me,1,1.0
when i thought that,1,1.0
d it was late,1,1.0
i m afraid your,1,1.0
will gfail end been,1,1.0
please somebody hire me,1,1.0
the edge of the,1,1.0
and say bye before,1,1.0
break in my house,1,1.0
dream that u did,1,1.0
sun now my arms,1,1.0
i may have broke,1,1.0
my window snapping his,1,1.0
in next year being,1,1.0
a nasty cough i,1,1.0
mine has been bothering,1,1.0
because i had a,1,1.0
awake i just wan,1,1.0
but jeff will have,1,1.0
they compose poems or,1,1.0
that i missed her,1,1.0
sometimes i feel pathetic,1,1.0
snow days and thier,1,1.0
and go to new,1,1.0
still have washing in,1,1.0
business eating disorders are,1,1.0
legs and arms what,1,1.0
who came in after,1,1.0
so upset he spelled,1,1.0
house with jo the,1,1.0
a nasty display picture,1,1.0
really gone smh yo,1,1.0
against all you nonbelievers,1,1.0
say emotional im really,1,1.0
bed this morning but,1,1.0
irony inventor of ford,1,1.0
she will not last,1,1.0
know quot that something,1,1.0
serial card fraudster on,1,1.0
myself with a cold,1,1.0
bills now i have,1,1.0
m feelin sad depressed,1,1.0
used to be amp,1,1.0
the toilet sux and,1,1.0
wants to talk to,1,2.0
to leave a note,1,1.0
not look as good,1,1.0
the mom super power,1,1.0
makes that kind of,1,1.0
then a blog now,1,1.0
y cant we all,1,1.0
not going to badu,1,1.0
there ll be no,1,1.0
promised me birthday brekkie,1,1.0
and whatever the current,1,1.0
a lot of stress,1,1.0
hate the long drive,1,1.0
kidney hurts soo bad,1,1.0
so i feel like,1,1.0
is hating on my,1,1.0
partyin with out me,1,1.0
work internet access restrictions,1,1.0
should be finished but,1,2.0
nd it s so,1,1.0
miss them soo much,1,1.0
feeling pretty tired and,1,1.0
why is my internet,1,2.0
m so sleep deprived,1,1.0
men and women with,1,1.0
not getting all my,1,1.0
mean to laugh but,1,1.0
amp biz class if,1,1.0
my dog ran awayy,1,1.0
the weirdest hives all,1,1.0
hair and it still,1,3.0
shocked about the firing,1,1.0
quot i thought it,1,1.0
wishing i was anywhere,1,1.0
m really gon na,1,1.0
busy and not sitting,1,1.0
circuit breaker good times,1,1.0
that i havent started,1,1.0
it s herr dude,1,1.0
it makes me worry,1,1.0
are the worst feel,1,1.0
room its a hol,1,1.0
i hate this weather,1,1.0
aussie automatically came off,1,1.0
did nt hear back,1,1.0
missed the coffeeclub that,1,1.0
once when i was,1,1.0
problem is i no,1,1.0
that almost disgust me,1,1.0
i miss the seniors,1,1.0
same without the quot,1,1.0
my boo for days,1,1.0
i hate this bit,1,2.0
dont think im going,1,2.0
or lmao someone pls,1,1.0
do nt hurt me,1,2.0
sit in a house,1,1.0
miss lynne ashminov we,1,1.0
date like a man,1,2.0
ah so sorry i,1,1.0
alone thats ok i,1,1.0
paste tosser piss flap,1,1.0
much extra for it,1,1.0
lovely hair has been,1,1.0
in a blue vehicle,1,1.0
novacaine in my mouth,1,1.0
the crying of someone,1,2.0
stop so my stupid,1,1.0
d w i i,1,1.0
do nt like my,1,1.0
recognize my email addresses,1,1.0
ca nt read it,1,1.0
bad times for everyone,1,1.0
the dog s fault,1,1.0
s hilarious jizz in,1,1.0
nt think i d,1,1.0
is gon na explode,1,1.0
nt seem that long,1,1.0
just learned my lesson,1,1.0
cause these stupid people,1,1.0
ca nt breathe terrible,1,1.0
swine markets are in,1,1.0
really miss my satan,1,1.0
m so sad really,1,1.0
re not gon na,1,1.0
one of the saddest,1,1.0
i ai nt go,1,1.0
vote every day for,1,1.0
hurt my left knee,1,1.0
gutted she ca nt,1,1.0
fl missing ga like,1,1.0
taking care of yucky,1,1.0
to fly to florida,1,1.0
high and i m,1,1.0
i thought you would,1,1.0
talked to you in,1,1.0
i envy your productivity,1,1.0
tried to make it,1,1.0
you do nt reply,1,1.0
i hate having headrush,1,2.0
tea pitcher things so,1,2.0
missing all the good,1,2.0
butter stupid kids on,1,1.0
bad the weather sucks,1,1.0
out of my tips,1,1.0
i have drama almost,1,1.0
m engulfed in shooes,1,1.0
ca nt go out,1,1.0
it s old and,1,1.0
that it was a,1,1.0
but prison break series,1,2.0
i wish celebs could,1,2.0
any more silly man,1,1.0
but facebook and vrbo.com,1,1.0
device thing does nt,1,1.0
crappy karaoke game i,1,1.0
hate that costco always,1,1.0
too late for the,1,1.0
has to be dried,1,1.0
should be studying i,1,1.0
track after school too,1,1.0
baby squirells she just,1,1.0
from an incredible sleep,1,1.0
why do none of,1,1.0
hate how ms makes,1,1.0
breaking my heart i,1,1.0
a dentention was so,1,1.0
way everyone i m,1,1.0
has anyone had that,1,1.0
work that one out,1,1.0
sad because the sale,1,1.0
refusn to get me,1,1.0
this part of the,1,1.0
find the grey hairs,1,1.0
nt even room for,1,1.0
is gon na bother,1,1.0
that i could nt,1,1.0
dangerous reckon it fits,1,1.0
today i think that,1,1.0
has not started out,1,1.0
driving me completely insa,1,1.0
he does nt want,1,1.0
to miss seeing you,1,1.0
stupid and wont let,1,1.0
not true plus you,1,1.0
think they have their,1,1.0
i know its hard,1,1.0
i just realized the,1,1.0
fix hurt feelings kev,1,1.0
yay for nice weather,1,1.0
hang out with me,1,1.0
nt let me watch,1,1.0
i only have in,1,1.0
i m so pissed,1,1.0
they cancel flights and,1,2.0
cant believe venus lost,1,1.0
wtf i wan na,1,1.0
makes me cry for,1,1.0
see in her that,1,1.0
i rly am going,1,1.0
choked on her retainers,1,1.0
dont think you can,1,1.0
you for no reason,1,1.0
just burned my tongue,1,1.0
the everything about seafood,1,2.0
grr fatboy slim is,1,1.0
one for a long,1,3.0
havent started i just,1,1.0
over i wont get,1,1.0
over and say bye,1,1.0
to do i ca,1,1.0
is making me sad,1,1.0
studying has really started,1,1.0
that seems totally ou,1,17.0
failed to leave a,1,3.0
all f d up,1,1.0
well its pouring here,1,2.0
why are money problems,1,2.0
the link does nt,1,1.0
she can drink but,1,1.0
nt get a boc,1,1.0
did not feel like,1,1.0
screwed i have an,1,1.0
to do but refuses,1,1.0
he must think i,1,1.0
miss you so muuch,1,1.0
and could nt afford,1,1.0
i did nt think,1,1.0
my new laptop at,1,1.0
be sick no mores,1,1.0
na go see the,1,3.0
ca nt work that,1,1.0
and just took the,1,1.0
got ta headache ugh,1,1.0
you are so weird,1,1.0
sunburn is not as,1,1.0
that ugh stupid verizon,1,1.0
have three hours to,1,1.0
hot and humid today,1,1.0
the reason i m,1,1.0
his hat on hiphiphoray,1,1.0
own business eating disorders,1,1.0
bed with stomach ache,1,1.0
good as malaria affects,1,1.0
t after a month,1,1.0
box wo nt work,1,1.0
really disappointed i had,1,1.0
a pigeon today thought,1,1.0
mp forgot to turn,1,1.0
can call me anything,1,1.0
it was never to,1,1.0
to dance with tonight,1,1.0
none of the people,1,1.0
i wan na be,1,1.0
im in the house,1,1.0
witch im upstate in,1,1.0
be mean without you,1,1.0
a still hurting a,1,1.0
not a good start,1,1.0
am in the place,1,2.0
sick heavy fever went,1,1.0
school on monday to,1,3.0
i think the x3,1,1.0
feel for you all,1,1.0
he s got s,1,1.0
please all of my,1,1.0
its really hard to,1,1.0
gone i miss my,1,1.0
who thinks he can,1,1.0
quite work especially if,1,1.0
to work days off,1,1.0
picker she saw it,1,1.0
sore throat now dammit,1,1.0
it s only saturday,1,1.0
did i fail english,1,1.0
not appreciating you like,1,1.0
get in touch sooner,1,1.0
zemote.com out of the,1,1.0
those ignorent aholes wont,1,1.0
be outside for less,1,1.0
m not allowed to,1,8.0
going way too slow,1,3.0
rules are meant to,1,1.0
knee is hurting so,1,1.0
a given day it,1,1.0
m trapped at work,1,1.0
i m annoying myself,1,1.0
a new roof and,1,1.0
biker guy and how,1,1.0
it will turn out,1,1.0
wants to watch it,1,1.0
i have one more,1,2.0
without the quot baseball,1,1.0
took the tax out,1,1.0
happen in my grade,1,1.0
there could possibly be,1,1.0
today is just not,1,1.0
heading to the creek,1,1.0
room is too hot,1,1.0
i dont care who,1,1.0
a month it would,1,1.0
luck for pc gamers,1,1.0
lt has no internet,1,1.0
nt love me anymore,1,1.0
am at my highest,1,1.0
it s depressing i,1,1.0
month it would nt,1,1.0
sleep is not coming,1,1.0
pee were i stand,1,1.0
oh sorry not getting,1,1.0
one even liked my,1,1.0
nt enough room for,1,1.0
make my gums hurt,1,1.0
is at my house,1,1.0
my new kicks grr,1,1.0
bed so early oh,1,1.0
the worst feel like,1,1.0
this week only just,1,1.0
see him a lot,1,4.0
i feel like tweeting,1,1.0
it is nt moving,1,1.0
day no time to,1,1.0
so mad jason said,1,1.0
i m trying to,1,1.0
im so done with,1,1.0
up when you are,1,1.0
fix that ugh stupid,1,1.0
not feel like bein,1,1.0
to school amp picking,1,1.0
please do nt think,1,1.0
guess i fail cries,1,1.0
feel like death evil,1,1.0
his first busted lip,1,1.0
b weird without her,1,1.0
time i succeed with,1,1.0
responses why is my,1,1.0
bad my cable is,1,1.0
lynne ashminov we will,1,1.0
and bumps from festivus,1,4.0
funeral mixup as in,1,1.0
have to stay away,1,1.0
our politicians have no,1,1.0
the x3 is confusing,1,1.0
the one movie that,1,1.0
not to clutter up,1,1.0
omg garbo fake playing,1,1.0
and was maad gross,1,1.0
a debugging session when,1,1.0
to bless her cuz,1,1.0
and still no books,1,1.0
very bored all day,1,1.0
hte question that is,1,1.0
stupid net went down,1,1.0
away a ttc code,1,1.0
today quot life is,1,1.0
s watching house of,1,1.0
extremely bloated now for,1,1.0
not married any more,1,1.0
its soo close to,1,1.0
weather has been super,1,1.0
just stopped working all,1,1.0
i fee your pain,1,2.0
my tonsils get swollen,1,1.0
mp i miss my,1,1.0
na be this kind,1,1.0
and puffy eyes i,1,1.0
i am so bored,1,1.0
wish i had company,1,1.0
wednesday and not supposed,1,1.0
no1 cuz no1 is,1,1.0
will wake up sick,1,1.0
patronising imperialist monoculturalist amp,1,1.0
did i do wrong,1,1.0
living in mx which,1,1.0
be amp you get,1,1.0
look like an idiot,1,1.0
photos from the cell,1,1.0
ahh fcukk i missed,1,1.0
anyway you can get,1,1.0
in that heat is,1,1.0
is the stanley steemer,1,1.0
the cab really bad,1,1.0
forehead im such a,1,1.0
assignment due tomorrow that,1,1.0
be a victim like,1,1.0
i have no motivation,1,1.0
that sucks b are,1,1.0
i need some hug,1,1.0
time to have some,1,1.0
nt had one for,1,1.0
tori s dad they,1,1.0
i m dying or,1,1.0
the owners it s,1,1.0
mean lik sum1 was,1,1.0
close to me hard,1,1.0
to the song carefully,1,1.0
the yesterday live chat,1,1.0
there was nt enough,1,1.0
making trouble we could,1,1.0
saw beyonce on monday,1,2.0
my student just walked,1,1.0
coast this weather here,1,1.0
i have an assignment,1,1.0
nt sound too great,1,1.0
triple twitter post was,1,1.0
im a lil sad,1,16.0
amp now i feel,1,11.0
earlier in the year,1,2.0
ago she s going,1,2.0
working nights cos i,1,5.0
i was so hopeful,1,1.0
everyday is a day,1,1.0
did not eat that,1,1.0
like procrastination and assumption,1,1.0
it s looking rly,1,1.0
in the house in,1,1.0
me feel really unpopular,1,1.0
hard to get up,1,1.0
has happened cos it,1,1.0
some times i do,1,1.0
wtf why does everyone,1,1.0
and tuesday dumb snow,1,1.0
issue in his back,1,1.0
trying my dang hardest,1,1.0
ever heard of school,1,1.0
and only hours to,1,1.0
cracked screen on my,1,1.0
cassadee tomorrow now fricken,1,1.0
have a scroll ball,1,1.0
time to be going,1,1.0
are the worst mahn,1,1.0
me i ca nt,1,1.0
had the weirdest dream,1,1.0
daammnn i do wish,1,1.0
plaster im going to,1,1.0
people to get on,1,1.0
quot aarrgghh quot is,1,1.0
mad it wasnt scarey,1,1.0
blog now they have,1,1.0
i ll take it,1,1.0
im alreadt crazy so,1,1.0
more like procrastination and,1,2.0
into a debugging session,1,3.0
what the heck am,1,1.0
somehow last night hurts,1,1.0
want to listen i,1,1.0
sorry did nt get,1,5.0
if they played pushit,1,1.0
she never even emailed,1,1.0
my ipod touch is,1,1.0
near as exciting as,1,1.0
in this hallway i,1,1.0
tweet deck let me,1,1.0
obsessed xd i miss,1,1.0
missed the yesterday live,1,1.0
average person average salary,1,1.0
grades time i ve,1,1.0
hair because then it,1,1.0
apple is also rotten,1,1.0
never been this slow,1,1.0
r these exams ever,1,1.0
my blog was marked,1,1.0
z i really dont,1,1.0
things to do and,1,1.0
grr i hate being,1,1.0
was sweating god knows,1,1.0
nursing my scratches and,1,1.0
so did ohh no,1,1.0
refuses to do them,1,1.0
was nt what it,1,1.0
have gone throo im,1,1.0
door handle murdered earlier,1,1.0
internet just crashed i,1,1.0
fist fight with a,1,1.0
conflicts but that s,1,1.0
i dont think im,1,2.0
like have do yucky,1,1.0
see my teachers i,1,2.0
to the owners it,1,1.0
pulling myself out of,1,1.0
on a call yo,1,1.0
out of everything so,1,1.0
me wise i will,1,1.0
just spit my drink,1,1.0
never see him a,1,1.0
some online banking which,1,1.0
is no fun without,1,1.0
for me today not,1,1.0
idea what to do,1,1.0
for endofrope action yet,1,1.0
computer is being stupid,1,1.0
so it makes me,1,1.0
work to interrupt i,1,1.0
nt say that anymore,1,1.0
in awful traffic in,1,1.0
nt have missed her,1,1.0
the mustangs game tomorrow,1,1.0
um that s really,1,1.0
ng wkds are the,1,1.0
had to be up,1,1.0
wan na believe it,1,1.0
now this is annoying,1,1.0
me s dead and,1,1.0
minute before getting your,1,1.0
groundbreaking production i sent,1,1.0
got ta say all,1,1.0
friend told me once,1,4.0
a lay making the,1,1.0
time is just dragging,1,1.0
what are these americans,1,1.0
use my mom fell,1,1.0
loser on hallmark never,1,2.0
has been bothering me,1,1.0
usually to the people,1,1.0
not a good song,1,1.0
stupid cobblestones now my,1,1.0
yeah its super today,1,1.0
sure when your shows,1,1.0
my parents the bed,1,1.0
in the right part,1,1.0
i thought will eventually,1,1.0
is the only thing,1,1.0
nerd im writin no1,1,1.0
my head hurts rly,1,1.0
nt sound very good,1,1.0
i somehow miss you,1,1.0
no internet i have,1,1.0
more due to how,1,1.0
m sure i forgot,1,1.0
dont feel very good,1,1.0
your in trouble now,1,1.0
in front of the,1,1.0
ca nt say that,1,1.0
URL this is my,1,1.0
leave does to me,1,1.0
dont want to leave,1,1.0
out its gna b,1,1.0
r that makes me,1,1.0
very rough today it,1,1.0
twittering makes me a,1,1.0
did nt which should,1,1.0
going back to school,1,1.0
re a bad sister,1,1.0
cryin right now as,1,1.0
almost always rains on,1,1.0
i ll hit you,1,3.0
go a bit loopy,1,2.0
over and done with,1,1.0
just had a nosebleed,1,1.0
need to be alone,1,1.0
is dangero waa crash,1,1.0
working but the sun,1,1.0
trying to cheer you,1,1.0
of your bliss in,1,1.0
my phone is broken,1,1.0
are really hurting now,1,1.0
why is my macbook,1,1.0
wow i love how,1,1.0
pain in the them,1,1.0
nt really been happy,1,1.0
d help you if,1,1.0
the empire puzzle stuck,1,1.0
owners it s not,1,1.0
of the nail of,1,1.0
stoopid lime aka cable,1,1.0
up with a nasty,1,1.0
result shots are all,1,1.0
s fault it s,1,1.0
and my saturday is,1,1.0
i have a serious,1,1.0
where the hell i,1,1.0
i think that i,1,1.0
addicting but its kind,1,1.0
think and i got,1,1.0
those pages are expensive,1,1.0
i miss ya ll,1,1.0
i hate those kinda,1,1.0
gon na be happy,1,1.0
plus our neighbor died,1,1.0
i missed giving away,1,1.0
swollen and they hurt,1,1.0
gon na miss my,1,1.0
and was playin security,1,1.0
it s hella itchy,1,1.0
so lazy time to,1,1.0
never quit smoking and,1,1.0
not awful but pretty,1,1.0
too well for yorkshire,1,1.0
hard to be a,1,1.0
to watch poor girl,1,1.0
or off key works,1,1.0
cutting out for no,1,1.0
thing i hate about,1,1.0
start work missing hel,1,1.0
re insulting me saying,1,1.0
nt find the original,1,1.0
happened to me once,1,1.0
been sick i want,1,1.0
of all bad days,1,1.0
in se asia come,1,1.0
this twitter bores me,1,1.0
just nothing perfect in,1,1.0
and my throat is,1,1.0
relocate to the west,1,1.0
a nerd im writin,1,1.0
someone tu cuddle sucks,1,1.0
and fight it of,1,1.0
holly gabbie and hannah,1,1.0
u i feel horrible,1,1.0
fell on the sidewalk,1,1.0
park in the free,1,1.0
songs and surveys they,1,1.0
nick s voice still,1,1.0
m very upset right,1,1.0
is gross outside it,1,1.0
would be lovely alas,1,4.0
nothing that s boring,1,3.0
crazy koreans are nt,1,2.0
oh god the cheesy,1,1.0
degrees as the high,1,1.0
new laptop at the,1,1.0
you re feeling under,1,1.0
fan of his music,1,1.0
right down the road,1,1.0
man i also believed,1,1.0
asleep cuz i know,1,17.0
only sites hosted on,1,1.0
i had a suspicion,1,1.0
i m stick in,1,2.0
met in thailand as,1,1.0
with that and supporting,1,1.0
nt want to sit,1,1.0
nt i was so,1,1.0
in the shade its,1,1.0
sisters refusn to get,1,1.0
up first time ever,1,1.0
it did nt listen,1,1.0
dog has died we,1,1.0
to get me a,1,1.0
idk if andy can,1,1.0
to sleep after cause,1,1.0
steel on bgt tonight,1,1.0
downtown or to the,1,1.0
sweatshirt and forgot to,1,1.0
just does nt sound,1,1.0
my friend wish i,1,1.0
how is she spoilt,1,1.0
my tv on demad,1,7.0
combo of mirrors edge,1,1.0
call history are gone,1,1.0
is not availble in,1,1.0
m afraid your comments,1,1.0
least you wont be,1,1.0
i only think of,1,1.0
books and things on,1,1.0
you ca nt turn,1,1.0
has his first busted,1,1.0
look as good as,1,2.0
i spent hours building,1,1.0
oh dear i m,1,8.0
meet you once do,1,1.0
you of how things,1,1.0
e such a nasty,1,1.0
a nice blue bruise,1,1.0
asia come visit us,1,1.0
sometimes ca nt even,1,1.0
craving that s very,1,2.0
the malicious action we,1,1.0
just hate looking at,1,1.0
last nite despite the,1,1.0
our conversation has been,1,1.0
grandas house just went,1,1.0
that cool or dangerous,1,2.0
throwing stuff onto the,1,1.0
to piss them off,1,1.0
to get out of,1,1.0
ocd moment i deleted,1,1.0
talking to harvard i,1,1.0
you re not in,1,1.0
im so lonely here,1,1.0
you re a real,1,1.0
why are tea pitcher,1,1.0
i ca nt work,1,1.0
the eye haha i,1,1.0
s nothing good on,1,1.0
the rez i d,1,1.0
i had a dream,1,1.0
re gon na miss,1,1.0
that drives me nuts,1,1.0
many people in the,1,1.0
i just feel like,1,1.0
melting and im in,1,1.0
na miss you so,1,1.0
to come then do,1,2.0
just had the weirdest,1,2.0
il just go and,1,1.0
get quot we re,1,1.0
i have a fever,1,1.0
you it d be,1,1.0
shots are all half,1,1.0
i dont feel so,1,1.0
home for summer it,1,1.0
i m so disgusted,1,1.0
so i hate staples,1,1.0
home by carrie underwood,1,1.0
lost a real shame,1,1.0
is nt on it,1,1.0
but i feel sorry,1,1.0
do nt be mad,1,1.0
today for being too,1,1.0
it reminds people what,1,1.0
nt be a victim,1,1.0
off today n sadly,1,1.0
a sudden now i,1,1.0
does nt feel right,1,1.0
seen enough movies to,1,1.0
oh no why did,1,1.0
out for no reason,1,1.0
ppl make me some,1,1.0
as malaria affects so,1,1.0
hopeless at everything else,1,1.0
am not cut out,1,1.0
working for me all,1,1.0
push that guy he,1,1.0
and neither is really,1,1.0
a stop sing and,1,1.0
my tea was rubbish,1,1.0
just found on abandoned,1,1.0
i m siick i,1,1.0
it s to hot,1,1.0
hate that feeling you,1,1.0
nt found a good,1,1.0
twitter or email at,1,1.0
on glade on debian,1,1.0
a christian is to,1,1.0
lunch decision should nt,1,1.0
nt think i ve,1,1.0
soo gon na fail,1,1.0
ve lost too many,1,1.0
new zealand so i,1,1.0
was a pain house,1,1.0
dog for a walk,1,1.0
to feel really panicky,1,1.0
a broken sunshade balcony,1,1.0
it said it was,1,1.0
us falling in love,1,1.0
wish i had money,1,3.0
not figure this twitter,1,2.0
get a bit gruesome,1,2.0
note to the owners,1,3.0
wondering what it will,1,1.0
nt we just all,1,1.0
what i thought will,1,1.0
on it lied last,1,1.0
sense when i m,1,1.0
nt think any less,1,1.0
the plug fuse now,1,1.0
have very sore feet,1,1.0
wow honestly not surprising,1,1.0
the stairs amp is,1,1.0
s just not right,1,1.0
thing does nt work,1,2.0
it s a sad,1,1.0
might just have made,1,1.0
on something when i,1,1.0
sucks because i thought,1,1.0
w it was that,1,1.0
card has been declined,1,1.0
what is wrong with,1,1.0
