,frequency,presence
my dang hardest to,1,1.0
think this will happen,1,1.0
i m too distracted,1,1.0
a burrito from chipotle,1,1.0
ok that s not,1,1.0
poop i hate being,1,1.0
plans for today just,1,1.0
by husker access no,1,1.0
me i mean lik,1,1.0
affects so many people,1,1.0
the world has become,1,1.0
these dogs are going,1,1.0
he was still in,1,1.0
sign that i m,1,1.0
that i can not,1,1.0
i m really disappointed,1,1.0
tech support ppl that,1,1.0
to shut up and,1,1.0
here comes the utter,1,1.0
month of school left,1,1.0
have never had like,1,1.0
bad missed the up,1,1.0
on my bus ruined,1,1.0
just because i set,1,1.0
have nt met the,1,6.0
soo tired dont know,1,1.0
sapinsidetrack in palo alto,1,1.0
broken amp im too,1,1.0
fought jered to the,1,1.0
twitter network glitch but,1,1.0
realized i booked a,1,1.0
of me i swear,1,1.0
not eating lunch with,1,1.0
bored for my last,1,1.0
documentation is not yet,1,1.0
the bad weather with,1,1.0
to do some online,1,1.0
semiflaky self but facebook,1,1.0
a good last saturday,1,1.0
did nt put any,1,1.0
any pets in the,1,1.0
my grandas house just,1,1.0
very unlucky the day,1,1.0
my make up first,1,1.0
on demad isnt working,1,1.0
a million people to,1,1.0
our home by myself,1,1.0
feeling like i have,1,1.0
we could take him,1,1.0
help him nothing i,1,1.0
wish i had nt,1,1.0
it s their owne,1,1.0
into nyc until so,1,1.0
are bugs attacking my,1,1.0
as bad luck day,1,1.0
cut my thumb on,1,1.0
part of my back,1,1.0
it up tomorrow return,1,1.0
so many finals to,1,1.0
has them men and,1,1.0
it s cold freakin,1,1.0
never seems to do,1,1.0
am little bit upset,1,1.0
man they better do,1,1.0
good day i havent,1,1.0
hot here in texas,1,1.0
i can not deal,1,1.0
for me today arg,1,1.0
cramps in my legs,1,1.0
not really in a,1,1.0
file that i spent,1,1.0
us to be quiet,1,1.0
i am soo screwed,1,1.0
be a messy eater,1,1.0
misses the good old,1,1.0
i missed you on,1,1.0
left my house in,1,1.0
just died rip julio,1,1.0
a good one assholes,1,1.0
my body decided it,1,1.0
it possible to a,1,1.0
that is nt going,1,1.0
even have a scroll,1,1.0
her dog getting hit,1,2.0
too late hes gone,1,1.0
too many friends i,1,1.0
has bit the dust,1,1.0
it on the sly,1,1.0
wo nt be as,1,1.0
warning tweeting while ridding,1,1.0
sorry hun im sure,1,1.0
aww i hate that,1,1.0
annoying and makes us,1,1.0
coming and recording about,1,1.0
nt call that cool,1,1.0
looks like you got,1,1.0
women with no capacity,1,1.0
being stupid and wont,1,1.0
in cinemas have the,1,1.0
the film im so,1,1.0
how things used to,1,1.0
hr stuf ppl s,1,1.0
i m running a,1,1.0
no fun being forced,1,2.0
it really does nt,1,9.0
hard to get motivated,1,2.0
helps me not go,1,2.0
my cat has been,1,1.0
learn to shut up,1,1.0
nt even tease people,1,1.0
bouncing rush makes me,1,1.0
think you missed all,1,1.0
me anything but quot,1,1.0
away doing stuff and,1,1.0
trackpad and the battery,1,1.0
you in a really,1,1.0
have dissappointed me that,1,1.0
to head downtown now,1,1.0
manned it up looks,1,1.0
is a nogo since,1,1.0
you head to parallel,1,1.0
m so broke life,1,1.0
challanges of movingcariphone photography,1,1.0
was just angrily told,1,1.0
electric but is gas,1,1.0
im going out today.ugh,1,1.0
working ugh also mom,1,1.0
get to see any,1,1.0
boredd the day has,1,1.0
up and still feeling,1,1.0
you manned it up,1,1.0
day was nt the,1,1.0
out today but i,1,1.0
their last nsw show,1,1.0
discovery just missed being,1,1.0
groups pains of computer,1,1.0
flapataco was nice until,1,1.0
cough i cant be,1,1.0
m confused and sad,1,1.0
quot arguing quot abou,1,1.0
want to come home,1,1.0
in a bit mr,1,1.0
mosquito chased me inside,1,1.0
chips any more due,1,1.0
original raise please do,1,1.0
usb webcam mic does,1,1.0
very good at funerals,1,1.0
that rule that says,1,2.0
forgot about it until,1,1.0
shrunk my favourite cardigan,1,1.0
should be going to,1,1.0
scratches and bumps from,1,1.0
we watched that one,1,1.0
do nt entertain him,1,1.0
get me to brooklyn,1,1.0
flareup in my life,1,1.0
gon na explode a,1,1.0
this place but ca,1,1.0
head over there soon,1,1.0
excited bby i hear,1,1.0
were in one piece,1,1.0
neither is really up,1,1.0
nothing to do so,1,1.0
he s in bed,1,1.0
fever went to dr,1,1.0
that should be illegal,1,1.0
online banking which sucks,1,1.0
nt want to well,1,3.0
for being too hopeful,1,1.0
says quot can not,1,1.0
get my cat killin,1,1.0
me to buy so,1,1.0
kind of party i,1,1.0
was nt the best,1,1.0
horriblel scent ever im,1,1.0
bored i have a,1,1.0
exsausted sweaty and chalky,1,1.0
though wish i had,1,1.0
it s a fake,1,1.0
it hard to cook,1,1.0
no cheers sad face,1,1.0
for everyone in nkorea,1,1.0
want a popsicle jealous,1,1.0
burnt my frkn tongue,1,1.0
the meeting dang i,1,1.0
to make a mess,1,1.0
year heaven.fr tell meh,1,1.0
i m freezing in,1,1.0
it has to be,1,1.0
was still in the,1,1.0
in thailand as an,1,1.0
come then do nt,1,1.0
i m going crazy,1,2.0
was absolutely excruciating to,1,1.0
i guess i fail,1,1.0
is why my mind,1,1.0
t you so i,1,1.0
felt like i was,1,1.0
say seems to be,1,2.0
the music nothing is,1,1.0
not trying hard enought,1,1.0
oh no thats no,1,1.0
did nt even get,1,17.0
he thinks he s,1,3.0
could nt save it,1,1.0
not good as malaria,1,1.0
i feel totally uncomfortable,1,1.0
a sucker for the,1,1.0
u feeling urself so,1,1.0
are meant to be,1,2.0
sorry i did nt,1,1.0
but refuses to do,1,1.0
missed my favorite judge,1,1.0
getting on my nerves,1,2.0
m freezing in math,1,1.0
the rain hates us,1,17.0
i dontlike the fact,1,3.0
wise old amp tiredd,1,1.0
get a fake id,1,1.0
i am soo hu,1,1.0
am sad that my,1,1.0
do but refuses to,1,3.0
to co host with,1,3.0
make a mess of,1,1.0
office desperately want to,1,1.0
me brittany forgot my,1,1.0
i still think their,1,1.0
to show how much,1,1.0
of school so sad,1,1.0
does nt sound so,1,1.0
is being at a,1,1.0
disappoint everyone else here,1,1.0
doing relay oh well,1,1.0
fml still awake melatonin,1,1.0
wo nt make it,1,1.0
get when you listen,1,1.0
are having a bad,1,1.0
wats wrong with her,1,1.0
study leave does to,1,1.0
has a really really,1,1.0
are hurting because i,1,1.0
bio final yay ugh,1,1.0
to buy here anyth,1,1.0
was looks like i,1,1.0
m going to get,1,1.0
have any excuse other,1,1.0
it s work but,1,1.0
of lonely when nobody,1,1.0
s work but seriously,1,1.0
i m having a,1,1.0
be your slave for,1,1.0
to do so sad,1,1.0
s show is a,1,1.0
battery life suck balls,1,1.0
am i allergic to,1,1.0
still hurting a little,1,1.0
just cut down all,1,1.0
was anywhere but here,1,1.0
quick i do nt,1,1.0
o i ll settle,1,2.0
nt just as easy,1,1.0
does nt like us,1,1.0
because no one ever,1,1.0
do wish i was,1,1.0
not happy at all,1,1.0
my parents put me,1,4.0
m lonely i need,1,1.0
sometimes it is hard,1,1.0
still not called me,1,1.0
bet you received lots,1,1.0
that im gon na,1,1.0
and things on it,1,9.0
head properly without a,1,4.0
internet no more privacy,1,2.0
he s just making,1,3.0
nt the best flick,1,1.0
in bed after a,1,1.0
we burnin up can,1,1.0
nt go to the,1,1.0
sorry i hate those,1,1.0
of my last friday,1,1.0
horrible he must think,1,1.0
did over react and,1,1.0
hurts and i feel,1,1.0
to cope with on,1,1.0
my aim is not,1,1.0
things are fkin costly,1,1.0
gets the no love,1,1.0
has been declined at,1,1.0
i missed you today,1,1.0
to end i ca,1,1.0
hate online summer classes,1,1.0
this part of india,1,1.0
the other day and,1,1.0
i didnt make u,1,1.0
is hurting so bad,1,1.0
had some spare cash,1,1.0
officially bit the dust,1,1.0
i wish we were,1,1.0
going to miss my,1,1.0
the neti pot is,1,1.0
afraid about the maths,1,1.0
i feel like dyeing,1,1.0
been so lonely without,1,1.0
i always miss it,1,1.0
come up with thing,1,1.0
time was had by,1,1.0
the world to me,1,1.0
if only i had,1,1.0
shots of novacaine in,1,1.0
could nt get back,1,1.0
hell i m doing,1,1.0
nt which should probly,1,2.0
could sleep but i,1,1.0
not i rarely dye,1,1.0
getting bored of walking,1,1.0
properly without a bad,1,1.0
wise i will soon,1,1.0
to be the i,1,1.0
stop thinking about you,1,1.0
some guys so stupid,1,1.0
i have to seperate,1,1.0
have nt unfollowed em,1,1.0
is my ohio is,1,1.0
thing i ate today,1,1.0
im all blistered it,1,1.0
children i guess i,1,1.0
it would cost too,1,1.0
so bad for holly,1,1.0
i tweet it anyways,1,1.0
interent day without net,1,1.0
out on all the,1,1.0
kinda turns me off,1,1.0
i am completely lost,1,1.0
pretty sure that it,1,1.0
i m losing my,1,1.0
like a truck just,1,1.0
are nt posting super,1,1.0
is also excellent for,1,1.0
taking a million songs,1,1.0
for all my efforts,1,1.0
computer being wiped clean,1,1.0
mud wrestling i swear,1,7.0
its prob cuz i,1,1.0
models version not so,1,6.0
will be seen by,1,1.0
break in my new,1,1.0
trying to record getting,1,1.0
get over on his,1,1.0
the worst feeling waking,1,1.0
it s all gone,1,1.0
i never order chips,1,1.0
headache and super swollen,1,1.0
that i had earlier,1,1.0
me about on a,1,1.0
i do wrong to,1,1.0
languish reading the news,1,1.0
noo i miss you,1,1.0
got to attend to,1,1.0
s mins late arriving,1,1.0
dog getting hit on,1,1.0
as effective as it,1,1.0
well it s not,1,1.0
ever and i do,1,1.0
going crazy the pain,1,1.0
most obvious thing though,1,1.0
i got in big,1,1.0
n up i did,1,1.0
breathe since getting the,1,1.0
much of it this,1,1.0
wo nt be there,1,1.0
had them this bad,1,1.0
then back to school,1,1.0
b are you ok,1,1.0
hilton jonathan was so,1,1.0
building just because i,1,1.0
day of work and,1,1.0
has stuff to do,1,2.0
re a real i,1,1.0
i would vote for,1,1.0
no fun i hate,1,1.0
because i was standing,1,1.0
still awake melatonin not,1,1.0
i hate that this,1,2.0
totally bummed me out,1,1.0
jumping off the nearest,1,1.0
quot sanctity quot of,1,1.0
i m lacking in,1,1.0
na cry at my,1,1.0
even fit in g,1,1.0
enough to overcome the,1,1.0
who gets mad i,1,1.0
flight to sfo cheaper,1,1.0
a nosebleed first time,1,1.0
in wrong remains delivered,1,1.0
me that past few,1,1.0
times worth of parts,1,1.0
a saturday night shock,1,1.0
insulting me saying that,1,1.0
guy just said he,1,1.0
nearest bridge if i,1,1.0
hell did i leave,1,1.0
fun but hell you,1,1.0
you guys did nt,1,1.0
look beautiful like those,1,1.0
nt made it downtown,1,1.0
declined at this tim,1,1.0
year being a perfectionist,1,1.0
i need a blackberry,1,1.0
normal i miss my,1,1.0
look any better for,1,1.0
haha he then socked,1,1.0
throat still hurts from,1,1.0
now it s like,1,1.0
weekend that is hte,1,1.0
more of a parody,1,1.0
are heading to the,1,1.0
nt feel good have,1,1.0
it breaks my heart,1,1.0
refused to feel the,1,1.0
too effing hot in,1,1.0
shows are over there,1,1.0
nt respond what s,1,1.0
it matches my mood,1,1.0
too good at all,1,1.0
runny nose i ca,1,1.0
gfail end been on,1,1.0
im back to this,1,1.0
stupidly sick cancelled our,1,1.0
nyc until so i,1,1.0
much time for design,1,1.0
m so down again,1,1.0
aw was nt it,1,1.0
it feels like the,1,1.0
nt let me post,1,1.0
why does my boss,1,4.0
easy sleeping pills need,1,1.0
they quot and can,1,1.0
its the one movie,1,1.0
things that can happen,1,1.0
have poop on my,1,1.0
noticed in ur previous,1,1.0
paid my bills now,1,1.0
in the sun shinee,1,1.0
doesnt want exams next,1,1.0
pouring here rly rly,1,1.0
i hurt my index,1,1.0
farmer so we cheated,1,1.0
devastated she is i,1,1.0
to have no one,1,1.0
is traumatized and saddened,1,2.0
going to happen one,1,1.0
that and supporting two,1,2.0
there pain on the,1,1.0
i looked that much,1,1.0
to do it all,1,1.0
get less ideas every,1,1.0
n do nt wealth,1,1.0
buzzed out the juggler,1,1.0
i lived on the,1,1.0
got a video tape,1,1.0
have asprin here at,1,1.0
singstar without my fave,1,1.0
headache medicine in this,1,1.0
i could i would,1,1.0
sadly it does nt,1,1.0
for me what the,1,1.0
nite despite the twitter,1,1.0
sadly i can not,1,1.0
and failed to leave,1,1.0
m missing the boat,1,1.0
conjunctivitis in my left,1,1.0
much homework with paying,1,1.0
nothing it s sad,1,1.0
in grade but we,1,1.0
microsoft i want win,1,1.0
i never was good,1,1.0
you re not really,1,1.0
do with a good,1,1.0
especially hard to get,1,1.0
them i ll blame,1,1.0
s should nt have,1,1.0
the best of moods,1,1.0
when i m bored,1,1.0
so bored all period,1,1.0
ca nt take it,1,1.0
the irate callers who,1,16.0
would nt call that,1,2.0
i wish you were,1,1.0
no1 is followin me,1,1.0
shud have gone throo,1,1.0
nt say i m,1,1.0
se the wrong ca,1,1.0
break series finale sucked,1,1.0
am soo screwed i,1,1.0
is nt fair gt,1,1.0
i ve seen enough,1,1.0
it gets hurt everyone,1,2.0
exam on the monday,1,1.0
but i m siick,1,1.0
with his nose now,1,1.0
so sick it s,1,1.0
created a million people,1,1.0
h you lack time,1,1.0
with my illness comes,1,1.0
from too much piriton,1,1.0
and now i ca,1,1.0
home with chocolate and,1,1.0
be getting my free,1,1.0
the second day in,1,1.0
a really weird night,1,1.0
bout tu hit the,1,1.0
need of an adjustment,1,1.0
we have wasted our,1,1.0
my mom is sick,1,1.0
sucked butt toes not,1,1.0
r disappointing this year,1,1.0
through but have so,1,1.0
good i m sorry,1,1.0
a bad start to,1,1.0
i wish i knew,1,1.0
because it takes all,1,1.0
miss my satan kitty,1,1.0
my old phone already,1,1.0
not even paying attention,1,1.0
sore throat that s,1,1.0
route available the problem,1,1.0
ay it had to,1,1.0
but i to have,1,1.0
here is killin me,1,1.0
taking forever to upload,1,1.0
in a rather bad,1,1.0
of having constant bad,1,1.0
so cold in here,1,1.0
really getting sick ugh,1,1.0
foot amp he bruised,1,1.0
mpg going in the,1,1.0
checked the plug fuse,1,1.0
good day one bad,1,1.0
i dont feel very,1,1.0
missed getting my quot,1,1.0
sitting here bored and,1,1.0
i miss you r,1,1.0
well my aunts dog,1,1.0
comments on mp s,1,1.0
i feel kinda sad,1,1.0
today sucks i just,1,1.0
grandmother in car accident,1,1.0
im gone miss ya,1,1.0
one loves me brittany,1,1.0
so upset for about,1,1.0
his mom amp now,1,1.0
by stupid bots so,1,1.0
hey sorry about your,1,1.0
not eat that burger,1,1.0
sorry just noticed in,1,1.0
a real shame smh,1,1.0
bottom lip on the,1,1.0
dont miss me too,1,1.0
alas the cubs would,1,1.0
door too hard and,1,1.0
after a problem between,1,1.0
i could alter time,1,1.0
does to me if,1,1.0
no but this is,1,1.0
like i was gon,1,1.0
graandma s housee i,1,1.0
horses in both legs,1,1.0
do nt love me,1,1.0
missing my baby ducks,1,1.0
feet look better but,1,1.0
nt have a chance,1,1.0
get any work done,1,1.0
here lies a breast,1,1.0
my face amp le,1,1.0
serious well that sucks,1,1.0
racism gig this weekend,1,1.0
def need to hit,1,1.0
but it aint happening,1,1.0
this gorgeous weather as,1,1.0
you all our twittering,1,1.0
bad on the first,1,1.0
time did nt get,1,1.0
office just did dinner,1,1.0
screwed to hell by,1,1.0
a hot box an,1,1.0
last night all of,1,1.0
them maybe this is,1,1.0
my internet has been,1,1.0
belive i found out,1,1.0
leave me u shud,1,1.0
get into nyc until,1,2.0
s wayy to long,1,1.0
i ca nt hear,1,1.0
please dont do that,1,1.0
ca nt get any,1,1.0
is waiting very impatiently,1,1.0
all of my friends,1,1.0
nt love me no,1,1.0
bit i realy do,1,16.0
sucked the fun out,1,1.0
power back up not,1,1.0
tha nerve call my,1,1.0
and end up screwed,1,1.0
o i m not,1,1.0
was killed does nt,1,1.0
hurts sadly there ll,1,1.0
sorry about the weather,1,1.0
and the engine locked,1,1.0
sad carrie ca nt,1,1.0
i miss your dance,1,1.0
do when u have,1,1.0
is dull and uninteresting,1,1.0
and u do nt,1,1.0
nt let me leave,1,1.0
i tried to call,1,1.0
to fall asleep cuz,1,1.0
have fun just got,1,1.0
the internet no more,1,1.0
someone please tighten some,1,1.0
suck balls for quarters,1,1.0
my arms are red,1,1.0
injustice than we can,1,1.0
how bad it all,1,3.0
are some guys so,1,1.0
i wish the photos,1,1.0
phobia of phobias afraid,1,1.0
amp its all my,1,1.0
wow that had to,1,1.0
me sleep over sanzz,1,1.0
copilot baby we burnin,1,1.0
you aint answer my,1,1.0
knowledge is not a,1,1.0
love what s worse,1,1.0
stupid people dont have,1,2.0
next monday and tuesday,1,1.0
hate days like that,1,1.0
is going on with,1,1.0
nt like the other,1,1.0
am stuck at work,1,1.0
be broken to get,1,1.0
not feeling well at,1,9.0
it s going to,1,14.0
dont acid reflux and,1,1.0
problems so bad these,1,1.0
never reply back to,1,1.0
does nt exist anymore,1,1.0
not the fastest way,1,1.0
and i freakin miss,1,1.0
i dnt wan na,1,1.0
from shooting an engagement,1,1.0
im super hungry ugh,1,1.0
sorry i totally forgot,1,1.0
off the lower part,1,1.0
quot life is nt,1,1.0
to hear that though,1,1.0
you have the odd,1,1.0
me missed a yr,1,1.0
seriously do nt know,1,1.0
turn it off i,1,1.0
i really get to,1,1.0
do nt count on,1,1.0
ouuchh still hurting from,1,1.0
that makes me cry,1,1.0
me birthday brekkie in,1,1.0
s the rotten law,1,1.0
was rubbish and ive,1,1.0
find it in my,1,1.0
thing about the trip,1,1.0
my baby has his,1,1.0
quot have been bloc,1,1.0
i have the plague,1,1.0
am i getting shorter,1,1.0
you re the reason,1,1.0
vote for her out,1,1.0
he s probably not,1,1.0
hcore and is supposed,1,1.0
are money problems so,1,1.0
onto the ice i,1,2.0
are getting fewer and,1,1.0
you liked the name,1,2.0
for the triple twitter,1,1.0
gon na make it,1,1.0
decided it wanted to,1,1.0
completely reminds you of,1,1.0
the same problem in,1,1.0
have them reconnect my,1,1.0
life he replies usually,1,1.0
dying out anytime soon,1,1.0
i wo nt get,1,1.0
trying to get done,1,1.0
second day running this,1,1.0
was remembered of pentecost,1,1.0
the uk with no,1,1.0
nt i look beautiful,1,1.0
our philly trip sad,1,1.0
hurts and this really,1,1.0
be though wish i,1,1.0
to push that guy,1,5.0
email the tech support,1,2.0
to get done before,1,1.0
ca nt even read,1,1.0
so it helps me,1,1.0
we re sorry your,1,1.0
chars and less replies,1,1.0
again brooke omg you,1,1.0
and the car thing,1,1.0
they make my gums,1,1.0
stuff to do but,1,1.0
nt have a teacher,1,1.0
that follow sports and,1,1.0
side of my earphones,1,1.0
sad that shes missing,1,1.0
dance will bring my,1,1.0
miss chatting with you,1,1.0
sit weirdly at the,1,1.0
to do them at,1,1.0
sick and it does,1,1.0
fun as you would,1,1.0
it s killen me,1,1.0
i may shed a,1,1.0
the whole family is,1,2.0
hard time sleeping on,1,1.0
think it s the,1,1.0
already on the bus,1,1.0
beginning of what may,1,1.0
it s the rotten,1,1.0
based on what i,1,1.0
serious hard time sleeping,1,1.0
he has to wait,1,1.0
on ya for a,1,1.0
quot they quot and,1,1.0
feeling well at all,1,1.0
though she seems so,1,1.0
wasted our vacation money,1,1.0
taking out the trash,1,1.0
for blocking creativity worse,1,1.0
for a walk they,1,1.0
the wee stpid thing,1,1.0
s enthusiasm in mee,1,1.0
teratoma has a cavity,1,1.0
i miss my brothers,1,1.0
after that oreo and,1,2.0
wo nt find nobody,1,1.0
poop on my shirt,1,1.0
is kinda freaking me,1,1.0
i have a really,1,1.0
unfortunately i am stuck,1,1.0
in an office i,1,1.0
i miss my daddy,1,1.0
highlight for soprano guy,1,1.0
birthday date is going,1,1.0
a headache from the,1,1.0
to rain on me,1,1.0
i just want things,1,1.0
i ll ever be,1,1.0
ugh another quot what,1,1.0
is on my mind,1,1.0
lost all my friends,1,1.0
that today s show,1,1.0
the puppy is sick,1,1.0
all into a minibus,1,1.0
suck being the only,1,1.0
a ball somewhere and,1,1.0
reply back to me,1,1.0
no one even liked,1,1.0
friday tubes at work,1,1.0
be very hard to,1,1.0
why do i always,1,1.0
i feel like ish,1,1.0
ran a stop sing,1,1.0
i wont be home,1,1.0
is slow and the,1,1.0
is or my mind,1,1.0
m not getting the,1,1.0
them and feet look,1,1.0
shakalohana week two of,1,1.0
i think or very,1,1.0
hard not to but,1,1.0
way to the wedding,1,1.0
that happened to me,1,1.0
a miss my lil,1,1.0
flu and bronchitis but,1,1.0
is getting a raise,1,1.0
dont study then i,1,1.0
i m not feeling,1,1.0
home sweet home by,1,1.0
to buy new ones,1,1.0
gon na go back,1,1.0
love they really have,1,1.0
feel so depressed that,1,1.0
i miss out on,1,1.0
so sorry that really,1,1.0
even be outside for,1,1.0
is nt moving fast,1,1.0
i will never see,1,1.0
missed bus walking miles,1,1.0
sometimes people never learn,1,1.0
lil while longer it,1,1.0
all the time poor,1,1.0
he had misbehaved specifically,1,1.0
bugger all food in,1,1.0
hate it so much,1,1.0
friends i do feel,1,1.0
quot that page does,1,1.0
thanks pal just bored,1,1.0
hug i m doing,1,1.0
mouse laptop touch pad,1,1.0
newest version on glade,1,1.0
shocked me to the,1,1.0
nt even have a,1,1.0
edge of the table,1,1.0
happen in a we,1,1.0
omg that s so,1,1.0
a stroke everytime i,1,1.0
i m so sleep,1,1.0
who hit my car,1,1.0
walmart was so hot,1,1.0
just right down the,1,1.0
got all f d,1,1.0
things to go back,1,1.0
classes i m a,1,1.0
very very nervous bah,1,1.0
i shrunk my favourite,1,1.0
friday feels boring too,1,1.0
they say you should,1,1.0
worried about being overwhelmed,1,1.0
cant im not my,1,1.0
i have a real,1,1.0
which sucks because i,1,1.0
day i havent had,1,1.0
treating me well so,1,1.0
melted ice cream do,1,1.0
believe in my eyes,1,1.0
film did nt come,1,1.0
too hot to be,1,1.0
needs stop taking mine,1,1.0
gon na be late,1,1.0
is still missing her,1,1.0
to the creek the,1,1.0
holy i am exhausted,1,1.0
that her back is,1,1.0
day classes i m,1,1.0
kinda pissed really wanted,1,1.0
pass a lay making,1,1.0
wo nt get you,1,1.0
one to become a,1,1.0
fucktards and killing our,1,1.0
realized the true difficulty,1,1.0
if somebody does nt,1,1.0
do some online banking,1,1.0
i hate rain and,1,1.0
m not thrilled at,1,1.0
but got ta be,1,1.0
got back from six,1,1.0
head downtown now gd,1,1.0
that guy he gets,1,1.0
m messing with my,1,1.0
hate waking up early,1,1.0
the job in nashville,1,1.0
am hungry agaaiin maam,1,1.0
to hate it when,1,1.0
ever do to deserve,1,1.0
monday to be honest,1,1.0
it gets too chilly,1,1.0
in a bit of,1,1.0
not so fun part,1,1.0
so bad dang it,1,1.0
the unholy up christ,1,1.0
is feeling a bit,1,1.0
hit the sack its,1,1.0
you can vote anymore,1,1.0
ready for my trip,1,1.0
showin love no more,1,2.0
diamond earrings this makes,1,1.0
did nt go to,1,1.0
drink on stage tight,1,1.0
not professional at all,1,1.0
sunshade balcony and a,1,1.0
sore i supose yas,1,1.0
so bored in chem,1,1.0
cream at the crazy,1,1.0
and feet i ve,1,1.0
and is supposed to,1,1.0
re for my mama,1,1.0
sorry that really sucks,1,1.0
hate mother s day,1,1.0
b b d w,1,1.0
should nt complain theese,1,1.0
try to squeeze my,1,1.0
work during the storm,1,1.0
weirdest dream ever and,1,1.0
d is nt perfect,1,4.0
got things to do,1,1.0
loads wish i was,1,1.0
s tummy hurts just,1,1.0
bad for everyone in,1,1.0
i hope to see,1,1.0
paul scheuring but prison,1,1.0
kid is sick too,1,1.0
youre too busy for,1,1.0
finds the hardest thing,1,1.0
i give myself a,1,1.0
home amp is going,1,1.0
hate living down here,1,1.0
shade its not fair,1,1.0
wish i was home,1,1.0
tu cuddle sucks wbu,1,1.0
the pc i know,1,1.0
think that i did,1,1.0
that im starting to,1,1.0
flash is being tonight,1,1.0
i m really sad,1,1.0
but because i m,1,1.0
i ll have to,1,1.0
want to be going,1,1.0
is working hard or,1,1.0
my android phone when,1,1.0
disco music has started,1,1.0
oh no poor thing,1,1.0
myself for life if,1,1.0
than physics and now,1,1.0
i have another clot,1,1.0
not getting any treatments,1,1.0
day without net sads,1,1.0
mirrors edge and really,1,1.0
spam really has everything,1,1.0
the guinea pigs i,1,1.0
bad amp so does,1,1.0
its from all the,1,1.0
from chipotle or qdoba,1,1.0
bad i hate missing,1,1.0
sware to god i,1,1.0
i go paintballin again,1,1.0
feel extremely depressed right,1,1.0
stick with this fever,1,1.0
to grandma s cuz,1,1.0
i seriously need to,1,2.0
i had a few,1,1.0
stick in the exit,1,1.0
i can barely focus,1,1.0
boo for working on,1,4.0
so much for being,1,1.0
a pet cat apparently,1,1.0
i dont study then,1,1.0
impressed that it almost,1,1.0
wednesday already so i,1,2.0
a cavity and is,1,1.0
u do nt know,1,1.0
like i wanted to,1,1.0
for me off to,1,1.0
you even ask yes,1,1.0
the perfect fri ni,1,1.0
is up at the,1,1.0
derivative identity though well,1,1.0
right now this is,1,1.0
i miss you sweetie,1,1.0
wish the photos on,1,1.0
school for hours next,1,1.0
nt turning out so,1,1.0
on sunday r.i.p von,1,1.0
all the awesome weather,1,1.0
side door too hard,1,1.0
noes the tv is,1,3.0
may die without my,1,1.0
nt find it in,1,1.0
cope with on my,1,1.0
is giving me a,1,1.0
at its finest go,1,1.0
bad news i have,1,1.0
one to do it,1,1.0
in the way to,1,1.0
quot vacation quot which,1,1.0
aah i m tired,1,1.0
like a whole new,1,1.0
only reason people have,1,1.0
s so weird being,1,1.0
listen to a song,1,1.0
i love they really,1,1.0
like i m on,1,1.0
for about more hours,1,1.0
to flick through but,1,1.0
one will accompany her,1,3.0
feeling you get when,1,1.0
ye it is not,1,1.0
trying to fix some,1,1.0
creeper i feel disappointed,1,1.0
of people becoming unemployed,1,1.0
almost killed me and,1,1.0
home you so suck,1,1.0
was crying it was,1,1.0
no idea what to,1,1.0
why have you still,1,1.0
imperialist monoculturalist amp selfrighteous,1,1.0
how are u i,1,1.0
juz missed my last,1,1.0
sick headache bored tiredd,1,1.0
im not liking how,1,1.0
link did nt work,1,1.0
it takes all effing,1,1.0
you re just jealous,1,1.0
big choice to make,1,1.0
sorry you re sick,1,1.0
i have to go,1,1.0
s kinda mean dont,1,1.0
after a hour work,1,1.0
clear it do nt,1,1.0
he s so mea,1,1.0
really really long time,1,1.0
angry that i missed,1,1.0
one with the problem,1,1.0
to take an impromptu,1,1.0
i juz missed my,1,1.0
have a major headache,1,1.0
performing drink on stage,1,1.0
the maine tomorrow because,1,1.0
not go off da,1,1.0
disturbed they sold the,1,1.0
oh i forgot they,1,1.0
ouch burnt my arm,1,1.0
hours at work till,1,1.0
nt beat it i,1,1.0
at the dr i,1,1.0
internet i have nt,1,1.0
to reply on tumblr,1,1.0
at home have very,1,1.0
m stuck with boo,1,1.0
now for the not,1,1.0
such delayed responses why,1,1.0
was an exploit attempt,1,1.0
weekend was over alreadi,1,1.0
stop thinking of him,1,1.0
i m bare behind,1,1.0
laughed at today for,1,1.0
since we ca nt,1,1.0
i m sure i,1,1.0
to be dragged out,1,1.0
